Article Title,Author,Journal Title,ISSN,ISBN,Publication Date,Volume,Issue,First Page,Page Count,Accession Number,DOI,Publisher,Doctype,Subjects,Keywords,Abstract,PLink
"Dynamic Populations in a Dynamic Landscape: The Metapopulation Structure of the Marsh Fritillary Butterfly","Niklas Wahlberg; Teemu Klemetti; Ilkka Hanski","Ecography",="09067590",,="2002","25","2","224","9","edsjsr.3683604",,"Blackwell Publishers","research-article","Metapopulation ecology; Butterflies; Meadows; Habitat destruction; Habitat conservation; Habitats; Forest habitats; Host plants; Conservation biology; Wetland ecology",,"The marsh fritillary butterfly Euphydryas aurinia is an endangered species in most of northern Europe. We describe the metapopulation structure of E. aurinia in Finland, where the species has declined drastically in the past decades. We found two types of habitat patches suitable for the species: semi-permanent meadows and transient clearcuts in the forest. Patch area was the most significant variable predicting the occurrence of E. aurinia in a habitat patch. The species tended to be found in young rather than old clearcuts, apparently because the vegetation became too high in the latter. We used the incidence function model to simulate the metapopulation dynamics of E. aurinia in its dynamic landscape and discovered that the continued presence of the semi-permanent meadows is essential for the survival of the species in the study area in southeast Finland.","https://search.ebscohost.com/login.aspx?direct=true&AuthType=sso&db=edsjsr&AN=edsjsr.3683604&site=eds-live&scope=site&custid=s2775460"
"Epiphyte metapopulation dynamics are explained by species traits, connectivity, and patch dynamics","Snäll, Tord; Johansson, Victor; Ranius, Thomas; Sveriges lantbruksuniversitet, Originator","Ecology",="00129658",,="2012","93",,"235","7","edsswe.oai.slubar.slu.se.43027","10.1890/11-0760.1","Ecological Society of America",,"Ecology; Ekologi",,"The colonization-extinction dynamics of many species are affected by the dynamics of their patches. For increasing our understanding of the metapopulation dynamics of sessile species confined to dynamic patches, we fitted a Bayesian incidence function model extended for dynamic landscapes to snapshot data on five epiphytic lichens among 2083 mapped oaks (dynamic patches). We estimate the age at which trees become suitable patches for different species, which defines their niche breadth (number of suitable trees). We show that the colonization rates were generally low, but increased with increasing connectivity in accordance with metapopulation theory. The rates were related to species traits, and we show, for the first time, that they are higher for species with wide niches and small dispersal propagules than for species with narrow niches or large propagules. We also show frequent long-distance dispersal in epiphytes by quantifying the relative importance of local dispersal and background deposition of dispersal propagules. Local stochastic extinctions from intact trees were negligible in all study species, and thus, the extinction rate is set by the rate of patch destruction (tree fall). These findings mean that epiphyte metapopulations may have slow colonization-extinction dynamics that are explained by connectivity, species traits, and patch dynamics.","https://search.ebscohost.com/login.aspx?direct=true&AuthType=sso&db=edsswe&AN=edsswe.oai.slubar.slu.se.43027&site=eds-live&scope=site&custid=s2775460"
"Comparison of two types of metapopulation models in real and artificial landscapes","Hokit, D. Grant; Stith, Bradley M.; Branch, Lyn C.","Conservation Biology",="08888892",,="2001","15","4","1102",,"edsgcl.128588351",,"Wiley Subscription Services, Inc.",,"Landscape -- Environmental aspects; Population research -- Models; Environmental policy",,"The two most common modeling techniques, incidence function model and stage-based matrix models is compared and their accuracy in predicting patch occupancy for a real metapopulation is presented. It is suggested that the understanding of different models becomes increasingly important as conservation programs undertake the challenge of managing for multiple species in a landscape context.","https://search.ebscohost.com/login.aspx?direct=true&AuthType=sso&db=edsgea&AN=edsgcl.128588351&site=eds-live&scope=site&custid=s2775460"
"Metacommunity, mainland-island system or island communities? Assessing the regional dynamics of plant communities in a fragmented landscape","Felix May; Itamar Giladi; Michael Ristow; Yaron Ziv; Florian Jeltsch","Ecography",="09067590",,="2013","36","7","842",,"edsjsr.ecography.36.7.842",,"Nordic Society Oikos","research-article",,,"Understanding the regional dynamics of plant communities is crucial for predicting the response of plant diversity to habitat fragmentation. However, for fragmented landscapes the importance of regional processes, such as seed dispersal among isolated habitat patches, has been controversially debated. Due to the stochasticity and rarity of among-patch dispersal and colonization events, we still lack a quantitative understanding of the consequences of these processes at the landscape-scale.","https://search.ebscohost.com/login.aspx?direct=true&AuthType=sso&db=edsjsr&AN=edsjsr.ecography.36.7.842&site=eds-live&scope=site&custid=s2775460"
"Epiphyte metapopulation dynamics are explained by species traits, connectivity, and patch dynamics","Victor Johansson; Thomas Ranius; Tord Snäll","Ecology",="00129658",,="2012","93","2","235",,"edsjsr.23143903",,"Ecological Society of America","research-article","Metapopulation ecology; Species extinction; Lichens; Tree age; Extinct species; Connectivity; Ecological modeling; Snails; Trees; Epiphytes",,"The colonization-extinction dynamics of many species are affected by the dynamics of their patches. For increasing our understanding of the metapopulation dynamics of sessile species confined to dynamic patches, we fitted a Bayesian incidence function model extended for dynamic landscapes to snapshot data on five epiphytic lichens among 2083 mapped oaks (dynamic patches). We estimate the age at which trees become suitable patches for different species, which defines their niche breadth (number of suitable trees). We show that the colonization rates were generally low, but increased with increasing connectivity in accordance with metapopulation theory. The rates were related to species traits, and we show, for the first time, that they are higher for species with wide niches and small dispersal propagules than for species with narrow niches or large propagules. We also show frequent long-distance dispersal in epiphytes by quantifying the relative importance of local dispersal and background deposition of dispersal propagules. Local stochastic extinctions from intact trees were negligible in all study species, and thus, the extinction rate is set by the rate of patch destruction (tree fall). These findings mean that epiphyte metapopulations may have slow colonization-extinction dynamics that are explained by connectivity, species traits, and patch dynamics.","https://search.ebscohost.com/login.aspx?direct=true&AuthType=sso&db=edsjsr&AN=edsjsr.23143903&site=eds-live&scope=site&custid=s2775460"
"A novel approach based on information theory to rank conservation strategies: an application to amphibian metapopulations",,"Animal conservation",="1367-9430",,="2008","11","6","453","10","IND44138862","10.1111/j.1469-1795.2008.00190.x",,"Journal Article","Rhine River; Switzerland",,"Habitat fragmentation, reduction and degradation as well as the quality of habitat connecting environments are critical for species persistence. Spatially explicit metapopulation models considering environmental effects are natural candidates for modelling population viability. However, metapopulations share the inherent uncertainties of the population concept with vague field population definitions. The recognition of the fuzzy nature of populations leads to operational definitions for management purposes. To deal with scarce information and uncertainties in predictions of intervention effects, Adaptive Management is useful. Accordingly, the synthesis of monitoring information is performed with models whose features are continuously adapted to the level of available information. To derive useful indices for conservation strategy evaluation, we propose a novel approach based on the Kullback-Leibler information measure. This is used to evaluate strategies aimed at the conservation of amphibians in an alpine Rhine valley region (Canton of the Grisons, Switzerland) and it is applied to outputs from an incidence function model for Bufo bufo and Rana temporaria. For these species, establishing four additional breeding sites along the Rhine river is a better strategy than placing two additional sites in intensively cultivated land. Artificial ponds in residential areas contribute to species conservation, and transfer of individuals to new sites has advantages over reliance on spontaneous colonization. Bufo bufo and R. temporaria reacted similarly to conservation measures, possibly due to their quite similar ecologies.","https://search.ebscohost.com/login.aspx?direct=true&AuthType=sso&db=agr&AN=IND44138862&site=eds-live&scope=site&custid=s2775460"
"Singleâspecies dynamic site selection","Moilanen, Atte; Mar Cabeza","Ecological applications",="1051-0761",,="2002","12","3","913","14","IND605875071","10.1890/1051-0761(2002)012%5B0913:SSDSS%5D2.0.CO;2",,"Journal Article","algorithms; butterflies; data collection; endangered species; models; reserve networks; system optimization; Finland",,"Methods for designing regional reserve networks mostly concentrate on providing maximal representation of species occurring in the region. Representationâbased methods, however, typically consider a static snapshot of species incidences, and the spatial dynamics of the species are ignored. It has been empirically demonstrated that reserves designed using representation do not guarantee another important goal of reserve design: longâterm persistence. The question studied here is the following: Which subset of sites do you select to maximize the longâterm persistence of a species living in a metapopulation, given that each site has a cost and the amount of resource (e.g., money) available is limited? We present an optimization method, which uses a combination of evolutionary optimization (a genetic algorithm) and local search to find the optimal selection of sites. The quality of each candidate solution is evaluated using a spatially realistic metapopulation model, the incidence function model. The proposed method is applied to a metapopulation of the false heath fritillary butterfly, an endangered species in Finland. With this data set, the proposed estimation method produces intuitively acceptable and consistent results within minutes of computation time. Sites favored by the algorithm are located in three patch clusters, and they tend to be inexpensive and initially occupied. Expensive and/or very isolated patches are rarely selected into the optimal site selection.","https://search.ebscohost.com/login.aspx?direct=true&AuthType=sso&db=agr&AN=IND605875071&site=eds-live&scope=site&custid=s2775460"
"Linking habitat use to range expansion rates in fragmented landscapes: a metapopulation approach","Robert J. Wilson; Zoe G. Davies; Chris D. Thomas","Ecography",="09067590",,="2010","33","1","73",,"edsjsr.20696332","10.1111/j.1600-0587.2009.06038.x","Blackwell Publishing","research-article","Habitat conservation; Climate change; Metapopulation ecology; Habitats; Butterflies; Habitat fragmentation; Species; Modeling; Species extinction; Rangelands",,"Temperature increases because of climate change are expected to cause expansions at the high latitude margins of species distributions, but, in practice, fragmented landscapes act as barriers to colonization for most species. Understanding how species distributions will shift in response to climate change therefore requires techniques that incorporate the combined effects of climate and landscape-scale habitat availability on colonization rates. We use a metapopulation model (Incidence Function Model, IFM) to test effects of fine-scale habitat use on patterns and rates of range expansion by the butterfly Hesperia comma. At its northern range margin in Britain, this species has increased its breadth of microhabitat use because of climate warming, leading to increased colonization rates. We validated the IFM by reconstructing expansions in five habitat networks between 1982 and 2000, before using it to predict metapopulation dynamics over 100 yr, for three scenarios based on observed changes to habitat use. We define the scenarios as ""cold-world"" (only hot, south-facing 150-250° hillsides are deemed warm enough), ""warm-world"" in which 100-300° hillsides can be populated, and ""hot-world"", where the background climate is warm enough to enable use of all aspects (as increasingly observed). In the simulations, increased habitat availability in the hot-world scenario led to faster range expansion rates, and to long-term differences in distribution size and pattern. Thus, fine-scale changes in the distribution of suitable microclimates led to landscape-scale changes in population size and colonization rate, resulting in coarse-scale changes to the species distribution. Despite use of a wider range of habitats associated with climate change, H. comma is still expected to occupy a small fraction of available habitat in 100 yr. The research shows that metapopulation models represent a potential framework to identify barriers to range expansion, and to predict the effects of environmental change or conservation interventions on species distributions and persistence.","https://search.ebscohost.com/login.aspx?direct=true&AuthType=sso&db=edsjsr&AN=edsjsr.20696332&site=eds-live&scope=site&custid=s2775460"
"Comparative Precision of Three Spatially Realistic Simulation Models of Metapopulation Dynamics","Oskar Kindvall","Ecological Bulletins",="03466868",,="2000",,"48","101",,"edsjsr.20113251",,"Munksgaard International Publishers Ltd.","research-article","Modeling; Metapopulation ecology; Habitats; Ecological modeling; Regression analysis; Parametric models; Logistic regression; Spatial models; Simulations; Colonization",,"I used field data from a fragmented population of the bush cricket Metrioptera bicolor (Orthoptera: Tettigoniidae) to evaluate whether different features of metapopulation dynamics, i.e. temporal changes in local and regional occupancy, can be accurately predicted by stochastic simulation models. Three different spatially realistic metapopulation models were considered: an incidence function model, a logistic regression model that was simulated using the METAPOP III program, and a demographic model used with the RAMAS GIS simulation package. All models gave good predictions about turnover rates and temporal changes in regional occupancy of M. bicolor. However, the predictions were less accurate regarding the fraction of time steps that individual habitat patches were occupied.","https://search.ebscohost.com/login.aspx?direct=true&AuthType=sso&db=edsjsr&AN=edsjsr.20113251&site=eds-live&scope=site&custid=s2775460"
"Incidence Function Modelling and Conservation of the Tree Frog Hyla arborea in the Netherlands","Claire C. Vos; Cajo J. F. Ter Braak; Wim Nieuwenhuizen","Ecological Bulletins",="03466868",,="2000",,"48","165",,"edsjsr.20113255",,"Munksgaard International Publishers Ltd.","research-article","Ponds; Metapopulation ecology; Colonization; Frogs; Species extinction; Connectivity; Ecological modeling; Habitat conservation; Habitat fragmentation; Modeling",,"The incidence function model (IFM) is a spatially realistic metapopulation model, in which extinction and colonisation probabilities are estimated from empirical data. We tested whether an IFM can be applied to quantify spatial habitat requirements for the protection and long-term survival of the tree frog Hyla arborea in Zealand Flanders, using a time series of three consecutive annual distribution patterns and dispersal data. The tree frog is an endangered species in the Netherlands and its distribution pattern is highly fragmented. An extended IFM was developed in which habitat quality parameters were incorporated to estimate functions for colonisation and extinction. A new method to estimate colonisation and extinction functions was developed, using both the turnover events between years and the spatial distribution pattern of the first year of survey. A logistic regression analysis indicated that the extinction probability decreased with pond size and that colonisation probability was higher for large ponds with high connectivity. The observed dispersal distances in comparison with the distances between ponds showed that the habitat network was still connected by dispersing individuals. The extended IFM quite accurately predicted the distribution pattern within a few years. However long-term predictions of metapopulation persistence were probably optimistic. A three-year data set is too short to incorporate the total range of fluctuations of population numbers between years. In addition deterministic extinctions due to habitat destruction and the loss of suitable habitat caused by natural succession were not incorporated in the model. It is concluded that the model could be a useful tool for conservation assessment when comparing different nature restoration scenarios and to provide general guidelines for an optimal tree frog landscape.","https://search.ebscohost.com/login.aspx?direct=true&AuthType=sso&db=edsjsr&AN=edsjsr.20113255&site=eds-live&scope=site&custid=s2775460"
"Butterflies of fragmented wet grassland in Western European lowland forests: Effects of vegetation, connectivity and plot size","Schlegel, Jürg; Hofstetter, Andreas","Acta oecologica",="1146-609X",,="2021","110",,,,"IND607209482","10.1016/j.actao.2020.103691",,"Journal Article","Euphydryas aurinia; Molinia; butterflies; habitat destruction; habitat fragmentation; habitats; lakes; landscapes; species richness; Switzerland; Conservation biology; Habitat isolation; Incidence function model IFM; Species-area relationship; Phengaris alcon",,"Habitat fragmentation, as a result of habitat loss and degradation, is widely considered to be a major threat to biodiversity. Our study focused on the distribution, diversity and abundance of butterflies on 22 isolated plots, mainly consisting of wet grassland. The plots were surrounded by deciduous mixed forests and located in an agglomeration area close to Lake Zurich, Switzerland. In addition to vegetation parameters, we assessed structural connectivity, adapted to least cost distances, using digital surface and terrain models. The resulting mixed-effects models revealed on plot level that (1) Molinia meadows had a significantly positive effect on rarefied Simpson butterfly diversity, (2) structural connectivity had a highly significant negative impact on rarefied Simpson butterfly diversity, whereas (3) plot size showed a significant positive impact, and (4) higher butterfly abundance was strongly related to blossom density. Across plot level, Molinia meadows had a higher rarefied butterfly species richness and rarefied Simpson butterfly diversity than any of the other habitat types evaluated. Among the endangered target species, the preferences of the Alcon Blue Phengaris alcon alcon were consistent with (1) to (3), while those of the Marsh Fritillary's E. aurinia aurinia were not. (2) is discussed with regards to the predominant influence of habitat type, vegetation and plot size, relativizing the effect of structural connectivity on butterfly communities in presumably resilient metapopulations. Ongoing targeted maintenance measures in the study area provide a promising basis for the sustainable conservation of local butterfly communities in isolated wet grassland plots.","https://search.ebscohost.com/login.aspx?direct=true&AuthType=sso&db=agr&AN=IND607209482&site=eds-live&scope=site&custid=s2775460"
"Intense grazing of calcareous grasslands has negative consequences for the threatened marsh fritillary butterfly","Johansson, Victor; Kindvall, Oskar; Askling, John; Franzén, Markus","Biological conservation",="0006-3207",,="2019","239",,,,"IND606739113","10.1016/j.biocon.2019.108280",,"Journal Article","Euphydryas aurinia; autumn; biodiversity; butterflies; chalk grasslands; extinction; grazing; habitats; landscapes; larvae; models; natural resources conservation; nests; probability; shrubs; soil quality; subsidies; threatened species; trees; Sweden; Incidence function model; Larvae autumn nests; Management; Metapopulation; Population persistence",,"Grazing generally benefits grassland biodiversity as it prevents shrub and tree succession. However, too intense grazing may have negative effects for example many grassland insects. EU-subsidies for grazing of some habitats, aimed at promoting biodiversity, still require a relatively intense grazing, and could therefore have negative consequences for some species. We quantified how such grazing affects habitat quality for the marsh fritillary butterfly, and how this influence its colonization-extinction dynamics and persistence. Specifically, we studied a metapopulation on Gotland (Sweden), where the marsh fritillary occupies unfertilized calcareous grassland with a naturally slow succession. We quantified the difference in larvae autumn nests between grazed and ungrazed habitat, and used this difference to adjust the ‘effective area’ of 256 habitat patches in a 50km2 landscape. We then parameterized a metapopulation model based on the occurrence pattern of the adult butterfly, and simulated future population development under different grazing regimes. The results showed that ungrazed habitat harbored 4.8 times more nests than grazed habitat. Reducing the ‘effective area’ of grazed patches accordingly increased the local extinction probability and decreased colonization. Grazing all suitable habitat reduced the occupancy by over 80%, while no grazing increased the occupancy by up to 40%, based on projections of future dynamics. Current grazing is clearly too intense, and EU-subsidies are here, thus, a conservation measure with negative consequences for a threatened butterfly. To prevent this, subsidies for grazing need to be more flexible and better adapted to the prevailing soil conditions and requirements of the target species.","https://search.ebscohost.com/login.aspx?direct=true&AuthType=sso&db=agr&AN=IND606739113&site=eds-live&scope=site&custid=s2775460"
"Protected areas in Borneo may fail to conserve tropical forest biodiversity under climate change","Scriven, Sarah A.; Jenny A. Hodgson; Colin J. McClean; Jane K. Hill","Biological conservation",="0006-3207",,="2015","184",,"414","10","IND605361167","10.1016/j.biocon.2015.02.018",,"Journal Article","agricultural land; altitude; biodiversity; climate; climate change; conservation areas; habitats; rain forests; spatial variation; temperature; tropical forests; Borneo; Connectivity; Forest fragmentation; Tropical deforestation; Incidence function model; Oil palm; Borneo",,"Protected areas (PAs) are key for conserving rainforest species, but many PAs are becoming increasingly isolated within agricultural landscapes, which may have detrimental consequences for the forest biota they contain. We examined the vulnerability of PA networks to climate change by examining connectivity of PAs along elevation gradients. We used the PA network on Borneo as a model system, and examined changes in the spatial distribution of climate conditions in future. A large proportion of PAs will not contain analogous climates in future (based on temperature projections for 2061–2080), potentially requiring organisms to move to cooler PAs at higher elevation, if they are to track climate changes. For the highest warming scenario (RCP8.5), few (11–12.5%; 27–30/240) PAs were sufficiently topographically diverse for analogous climate conditions (present-day equivalent or cooler) to remain in situ. For the remaining 87.5–89% (210–213/240) of PAs, which were often situated at low elevation, analogous climate will only be available in higher elevation PAs. However, over half (60–82%) of all PAs on Borneo are too isolated for poor dispersers (<1km per generation) to reach cooler PAs, because there is a lack of connecting forest habitat. Even under the lowest warming scenario (RCP2.6), analogous climate conditions will disappear from 61% (146/240) of PAs, and a large proportion of these are too isolated for poor dispersers to reach cooler PAs. Our results suggest that low elevation PAs are particularly vulnerable to climate change, and management to improve linkage of PAs along elevation gradients should be a conservation priority.","https://search.ebscohost.com/login.aspx?direct=true&AuthType=sso&db=agr&AN=IND605361167&site=eds-live&scope=site&custid=s2775460"
