"SVE5M8ID","journalArticle","","Govindan, Byju Nambidiyattil","The Role of Resource Predictability in the Metapopulation Dynamics of Insects","","","","","","","","2021-10-27 03:31:48","2021-10-27 03:31:48","","202","","","","","","","","","","","","","en","","","","","Zotero","","","","/Users/kelleherj/Zotero/storage/9INTTV33/Govindan - The Role of Resource Predictability in the Metapop.pdf","","","","","","","","","","","","","","","","","","","","","","","","","","","","","","","","","","","","","","","","","","","","","","","","",""
"2FGMZF3L","journalArticle","2019","Gallo, Travis; Fidino, Mason; Lehrer, Elizabeth W.; Magle, Seth","Urbanization alters predator‐avoidance behaviours","Journal of Animal Ecology","","0021-8790, 1365-2656","10.1111/1365-2656.12967","https://onlinelibrary.wiley.com/doi/10.1111/1365-2656.12967","","2019-05","2021-10-27 03:35:10","2021-10-27 03:35:10","2021-10-27 03:35:10","793-803","","5","88","","J Anim Ecol","","","","","","","","en","","","","","DOI.org (Crossref)","","","","/Users/kelleherj/Zotero/storage/TDWYM4NT/Gallo et al. - 2019 - Urbanization alters predator‐avoidance behaviours.pdf","","","","Loison, Anne","","","","","","","","","","","","","","","","","","","","","","","","","","","","","","","","","","","","","","","","","","","","",""
"GLSWRYUL","thesis","2015","Grant, Tyler John","Anuran occupancy dynamics and an assessment of floodplain wetland distribution and hydrology in a Missouri River floodplain","","","","","https://lib.dr.iastate.edu/etd/14200/","","2015","2021-10-27 03:35:12","2021-10-27 03:35:12","2021-10-27 03:35:12","","","","","","","","","","","","Iowa State University, Digital Repository","Ames","en","","Doctor of Philosophy","","","DOI.org (Crossref)","","Pages: 7780228 DOI: 10.31274/etd-180810-3751","","/Users/kelleherj/Zotero/storage/KE7ID2C6/Grant - 2015 - Anuran occupancy dynamics and an assessment of flo.pdf","","","","","","","","","","","","","","","","","","","","","","","","","","","","","","","","","","","","","","","","","","","","","","","","",""
"ISYJCZ52","journalArticle","2021","Rodhouse, Thomas J.; Rose, Sara; Hawkins, Trent; Rodriguez, Rogelio M.","Audible bats provide opportunities for citizen scientists","Conservation Science and Practice","","2578-4854, 2578-4854","10.1111/csp2.435","https://onlinelibrary.wiley.com/doi/10.1111/csp2.435","Bat conservation has been impeded by a lack of basic information about species' distributions and abundances. Public participation in closing this gap via citizen (community) science has been limited, but bat species that produce low-frequency calls audible to the unaided human ear provide an overlooked opportunity for collaborative citizen science surveys. Audible bats are rare in regional faunas but occur globally and can be under-surveyed by traditional methods. During 2019–2020, we were joined by community members to conduct aural surveys and expand our knowledge of rare audible desert bats in western North America through a structured survey design broadly adaptable for practitioners across the globe where audible bats occur. Our study was integrated into a statistically robust but flexible master sample in use by the North American Bat Monitoring Program (NABat), ensuring representativeness of data contributions. We used survey results to update a Bayesian species distribution model for the rare spotted bat, Euderma maculatum, accounting for imperfect detection and including land cover occupancy predictors. Detection probability was estimated ~0.7 ± 0.1. Informative priors from a previous attempt to model E. maculatum were leveraged with the new citizen science data to support spatial predictions of occurrence previously impeded by data sparsity and which reinforced the biogeographic importance of arid cliffs and canyons. Our results are preliminary but encouraging, and future surveys can scale up through the NABat design structure and Bayesian modeling framework. We encourage future surveys to use recording devices to obtain voucher calls and double-observer methods to address false-positive detection errors that arise with inexperienced volunteers. Our design and model supported approach to integrating citizen science surveys into bat conservation programs can strengthen both the scientific understanding of rare species and public engagement in conservation practices.","2021-07","2021-10-27 03:35:15","2021-10-27 03:35:15","2021-10-27 03:35:15","","","7","3","","Conservat Sci and Prac","","","","","","","","en","","","","","DOI.org (Crossref)","","","","/Users/kelleherj/Zotero/storage/UQQKBWPS/Rodhouse et al. - 2021 - Audible bats provide opportunities for citizen sci.pdf","","","","","","","","","","","","","","","","","","","","","","","","","","","","","","","","","","","","","","","","","","","","","","","","",""
"KVALKQDN","journalArticle","2019","Mangan, Anna O; Chestnut, Tara; Vogeler, Jody C; Breckheimer, Ian K; King, Wendy M; Bagnall, Keith E; Dugger, Katie M","Barred Owls reduce occupancy and breeding propensity of Northern Spotted Owl in a Washington old-growth forest","The Condor","","0010-5422, 1938-5129","10.1093/condor/duz031","https://academic.oup.com/condor/article/doi/10.1093/condor/duz031/5543734","Protected lands like national parks are important refuges for threatened and endangered species as environmental pressures on wildlife and their habitats increase. The Northern Spotted Owl (Strix occidentalis caurina), a species designated as threatened under the Endangered Species Act, occurs on public lands throughout the western United States including Mount Rainier National Park (MRNP), Washington. With virtually no history of timber harvest or large forest disturbance within MRNP boundaries since the park’s creation in 1899, MRNP provides an ideal place to evaluate potential impacts of climate change and invasive Barred Owls (Strix varia) on the Northern Spotted Owl. We used a multi-state, multi-season occupancy model to investigate how Northern Spotted Owl occupancy dynamics and breeding propensity are related to the presence of Barred Owls, local and regional weather, and habitat characteristics at MRNP from 1997 to 2016. Historical occupancy of Northern Spotted Owl breeding territories in MRNP has declined by 50% in the last 20 yr, and territory occupancy by breeding Northern Spotted Owls also decreased, reaching a low of 25% in 2016. Occupancy rates were higher on territories with steeper terrain and breeding rates were lower when Barred Owls were detected within historical territories. Our results also indicated that breeding propensity was higher when early nesting season temperatures during March and April were higher. In addition, the ability to detect breeding Northern Spotted Owls decreased when Barred Owls were present in the territory. Habitat variables from LiDAR were not correlated with Northern Spotted Owl occupancy dynamics, likely reflecting the dominance of old-growth forest in this protected park. This study illustrates the strong relationship between Barred Owls and Northern Spotted Owl demographics and breeding site selection in a landscape where habitat loss by timber harvest and fire has not occurred.","2019-08-26","2021-10-27 03:35:17","2021-10-27 03:35:17","2021-10-27 03:35:17","duz031","","3","121","","","","","","","","","","en","","","","","DOI.org (Crossref)","","","","/Users/kelleherj/Zotero/storage/R5GPS3FQ/Mangan et al. - 2019 - Barred Owls reduce occupancy and breeding propensi.pdf","","","","","","","","","","","","","","","","","","","","","","","","","","","","","","","","","","","","","","","","","","","","","","","","",""
"W7CRRTKW","journalArticle","2013","Webber, Alyson F.; Heath, Julie A.; Fischer, Richard A.","Human disturbance and stage-specific habitat requirements influence snowy plover site occupancy during the breeding season","Ecology and Evolution","","20457758","10.1002/ece3.511","https://onlinelibrary.wiley.com/doi/10.1002/ece3.511","Habitat use has important consequences for avian reproductive success and survival. In coastal areas with recreational activity, human disturbance may limit use of otherwise suitable habitat. Snowy plovers Charadrius nivosus have a patchy breeding distribution along the coastal areas on the Florida Panhandle, USA. Our goal was to determine the relative effects of seasonal human disturbance and habitat requirements on snowy plover habitat use. We surveyed 303 sites for snowy plovers, human disturbance, and habitat features between January and July 2009 and 2010. We made multiple visits during three different sampling periods that corresponded to snowy plover breeding: pre-breeding, incubation, and brood-rearing and used multi-season occupancy models to examine whether human disturbance, habitat features, or both inﬂuenced site occupancy, colonization (probability of transition from an unoccupied site to an occupied site), and extinction (probability of transition from an occupied site to an unoccupied site). Snowy plover site occupancy and colonization was negatively associated with human disturbance and site extinction was positively associated with human disturbance. Interdune vegetation had a negative effect on occupancy and colonization, indicating that plovers were less likely to use areas with uniform, dense vegetation among dunes. Also, dune shape, beach debris, and access to low-energy foraging areas inﬂuenced site occupancy, colonization, and extinction. Plovers used habitat based on beach characteristics that provided stage-speciﬁc resource needs; however, human disturbance was the strongest predictor of site occupancy. In addition, vegetation plantings used to enhance dune rehabilitation may negatively impact plover site occupancy. Management actions that decrease human disturbance, such as symbolic fencing and signage, may increase the amount of breeding habitat available to snowy plovers on the Florida Panhandle and in other areas with high human activity. The speciﬁc areas that require this protection may vary across snowy plover life history stages.","2013-04","2021-10-27 03:35:20","2021-10-27 03:35:20","2021-10-27 03:35:20","853-863","","4","3","","Ecol Evol","","","","","","","","en","","","","","DOI.org (Crossref)","","","","/Users/kelleherj/Zotero/storage/VFHY9B2V/Webber et al. - 2013 - Human disturbance and stage-specific habitat requi.pdf","","","","","","","","","","","","","","","","","","","","","","","","","","","","","","","","","","","","","","","","","","","","","","","","",""
"I7KVWLSP","journalArticle","2021","Huysman, Allison E.; Johnson, Matthew D.","Multi‐year nest box occupancy and short‐term resilience to wildfire disturbance by barn owls in a vineyard agroecosystem","Ecosphere","","2150-8925, 2150-8925","10.1002/ecs2.3438","https://onlinelibrary.wiley.com/doi/10.1002/ecs2.3438","Landscape composition can strongly affect the delivery of ecosystem services in agroecosystems. Conserving uncultivated habitats can support ecosystem services, but in Mediterranean biomes, these lands can also increase the area susceptible to wildﬁres. In the world-renowned wineproducing region of Napa Valley, California, wine grape growers install nest boxes to attract American barn owls (Tyto furcata), which may reduce rodent crop damage. Annual monitoring of 273 nest boxes began in 2015, and devastating wildﬁres burned approximately 60,000 ha in the region in 2017, including homes and businesses, as well as some vineyards and uncultivated land. The goal of this study was to determine whether changes in nest box occupancy were attributed to wildﬁres, nest box design, land cover type, or some combination of these variables. Occupancy surveys before and after these wildﬁres revealed changes in habitat selection at the nest scale. Occupancy increased during the study, reaching its highest point after the ﬁres. Owls were found breeding in recently burned areas that were previously unoccupied and modeling results showed that nest box occupancy had a positive relationship with burned areas, particularly with edges of the ﬁre perimeter. Barn owls also consistently showed a strong preference for taller nest boxes that were surrounded by more grassland than other land cover types and a moderate selection for wooden over plastic boxes. These results illustrate an incentive for the conservation of uncultivated habitat, particularly grassland, in vineyard ecosystems, and they provide an example of a mobile pest predator’s response to wildﬁre disturbance. In this case, results suggest an agroecosystem service made resilient to wildﬁre by the owls’ selection of burned and uncultivated habitats.","2021-03","2021-10-27 03:35:23","2021-10-27 03:35:23","2021-10-27 03:35:23","","","3","12","","Ecosphere","","","","","","","","en","","","","","DOI.org (Crossref)","","","","/Users/kelleherj/Zotero/storage/F6QA4UN9/Huysman and Johnson - 2021 - Multi‐year nest box occupancy and short‐term resil.pdf","","","","","","","","","","","","","","","","","","","","","","","","","","","","","","","","","","","","","","","","","","","","","","","","",""
"ZZFH7PJK","journalArticle","2015","Grant, Tyler J.; Otis, David L.; Koford, Rolf R.","Short-term anuran community dynamics in the Missouri River floodplain following an historic flood","Ecosphere","","2150-8925","10.1890/ES15-00011.1","http://doi.wiley.com/10.1890/ES15-00011.1","Extreme ecological disturbances such as floods, wildfires, and droughts are difficult to study because they are rare and unpredictable. We had the opportunity to study the effect of an historic flood on an anuran community in the Missouri River floodplain. We used occupancy estimation to estimate the proportion of wetlands occupied by calling adult male anurans. Three species—the plains leopard frog (Lithobates blairi ), Woodhouse’s toad (Anaxyrus woodhousii ), and Blanchard’s cricket frog (Acris blanchardi )—had only minor changes in occupancy rate two years after the flood. Colonization rates for these species were positively associated with wetlands that were shallower near the shore and they did not appear to be affected by reduced vegetation. Three other species or species complexes—the northern leopard frog (Lithobates pipiens), the gray treefrog complex (Hyla versicolor and Hyla chrysocelis), and the boreal chorus frog (Pseudacris maculata)—had greatly reduced occupancy rates two years after the flood. Colonization rates for these species were relatively low, while they had high extinction rates. Colonization rates for these species were not associated with any habitat characteristic we measured. Future flood events will likely continue to make northern leopard frogs, gray treefrogs, and boreal chorus frogs a less important part of the ecological community. While some species may fare well under extreme climate events, such as this flood, that are forecast under climate change scenarios, many species will struggle.","2015-10","2021-10-27 03:35:26","2021-10-27 03:35:26","2021-10-27 03:35:26","art197","","10","6","","Ecosphere","","","","","","","","en","","","","","DOI.org (Crossref)","","","","/Users/kelleherj/Zotero/storage/B7L9QSU4/Grant et al. - 2015 - Short-term anuran community dynamics in the Missou.pdf","","","","","","","","","","","","","","","","","","","","","","","","","","","","","","","","","","","","","","","","","","","","","","","","",""
"B839MVA2","journalArticle","2011","Zuckerberg, Benjamin; Bonter, David N.; Hochachka, Wesley M.; Koenig, Walter D.; DeGaetano, Arthur T.; Dickinson, Janis L.","Climatic constraints on wintering bird distributions are modified by urbanization and weather: Wintering birds, weather, food, and climate","Journal of Animal Ecology","","00218790","10.1111/j.1365-2656.2010.01780.x","https://onlinelibrary.wiley.com/doi/10.1111/j.1365-2656.2010.01780.x","","2011-03","2021-10-27 03:35:28","2021-10-27 03:35:28","2021-10-27 03:35:28","403-413","","2","80","","","Climatic constraints on wintering bird distributions are modified by urbanization and weather","","","","","","","en","","","","","DOI.org (Crossref)","","","","/Users/kelleherj/Zotero/storage/MPVN7X3Q/Zuckerberg et al. - 2011 - Climatic constraints on wintering bird distributio.pdf","","","","","","","","","","","","","","","","","","","","","","","","","","","","","","","","","","","","","","","","","","","","","","","","",""
"SHT9UFES","journalArticle","2011","MacKenzie, Darryl I.; Bailey, Larissa L.; Hines, James E.; Nichols, James D.","An integrated model of habitat and species occurrence dynamics: <i>Habitat and occupancy dynamic model</i>","Methods in Ecology and Evolution","","2041210X","10.1111/j.2041-210X.2011.00110.x","https://onlinelibrary.wiley.com/doi/10.1111/j.2041-210X.2011.00110.x","","2011-12","2021-10-27 03:35:31","2021-10-27 03:35:31","2021-10-27 03:35:31","612-622","","6","2","","","An integrated model of habitat and species occurrence dynamics","","","","","","","en","","","","","DOI.org (Crossref)","","","","/Users/kelleherj/Zotero/storage/F93WUAR6/MacKenzie et al. - 2011 - An integrated model of habitat and species occurre.pdf","","","","","","","","","","","","","","","","","","","","","","","","","","","","","","","","","","","","","","","","","","","","","","","","",""
"239HRAVR","journalArticle","2015","Goijman, Andrea Paula; Conroy, Michael. J.; Bernardos, Jaime Nicolás; Zaccagnini, María Elena","Multi-Season Regional Analysis of Multi-Species Occupancy: Implications for Bird Conservation in Agricultural Lands in East-Central Argentina","PLOS ONE","","1932-6203","10.1371/journal.pone.0130874","https://dx.plos.org/10.1371/journal.pone.0130874","","2015-06-18","2021-10-27 03:35:33","2021-10-27 03:35:33","2021-10-27 03:35:33","e0130874","","6","10","","PLoS ONE","Multi-Season Regional Analysis of Multi-Species Occupancy","","","","","","","en","","","","","DOI.org (Crossref)","","","","/Users/kelleherj/Zotero/storage/UVGPUHY5/Goijman et al. - 2015 - Multi-Season Regional Analysis of Multi-Species Oc.pdf","","","","Arlettaz, Raphaël","","","","","","","","","","","","","","","","","","","","","","","","","","","","","","","","","","","","","","","","","","","","",""
"XSUF8A4X","journalArticle","2018","Cruz, Jennyffer; Windels, Steve K.; Thogmartin, Wayne E.; Crimmins, Shawn M.; Grim, Leland H.; Zuckerberg, Benjamin","Managing individual nests promotes population recovery of a top predator","Journal of Applied Ecology","","0021-8901, 1365-2664","10.1111/1365-2664.13062","https://onlinelibrary.wiley.com/doi/10.1111/1365-2664.13062","","2018-05","2021-10-27 03:37:48","2021-10-27 03:37:48","2021-10-27 03:37:48","1418-1429","","3","55","","J Appl Ecol","","","","","","","","en","","","","","DOI.org (Crossref)","","","","/Users/kelleherj/Zotero/storage/SWL7GIAD/Cruz et al. - 2018 - Managing individual nests promotes population reco.pdf","","","","Fuller, Richard","","","","","","","","","","","","","","","","","","","","","","","","","","","","","","","","","","","","","","","","","","","","",""
"C4GBEP4C","journalArticle","2013","Sutherland, C.; Elston, D. A.; Lambin, X.","Accounting for false positive detection error induced by transient individuals","Wildlife Research","","1035-3712","10.1071/WR12166","http://www.publish.csiro.au/?paper=WR12166","Context. In metapopulations, colonisation is the result of dispersal from neighbouring occupied patches, typically juveniles dispersing from natal to breeding sites. When occupancy dynamics are dispersal driven, occupancy should refer to the presence of established, breeding populations. The detection of transient individuals at sites that are, by deﬁnition, unoccupied (i.e. false positive detections), may result in misleading conclusions about metapopulation dynamics. Until recently, the issue of false positives has been considered negligible and current efforts to account for such error have been restricted to the context of species misidentiﬁcation. However, the detection of transient individuals visiting multiple sites while dispersing is a distinct source of false positives that can bias estimates of occupancy because visited sites do not contribute to metapopulation dynamics in the same way as do sites occupied by established, reproducing populations. Although transient-induced false positive error presents a challenge to occupancy studies aiming to account for all sources of detection error and estimate occupancy without bias, accounting for it has received little attention.","2013","2021-10-27 03:37:51","2021-10-27 03:37:51","2021-10-27 03:37:51","490","","6","40","","Wildl. Res.","","","","","","","","en","","","","","DOI.org (Crossref)","","","","/Users/kelleherj/Zotero/storage/6IPY5WJA/Sutherland et al. - 2013 - Accounting for false positive detection error indu.pdf","","","","","","","","","","","","","","","","","","","","","","","","","","","","","","","","","","","","","","","","","","","","","","","","",""
"XUHMKI5R","journalArticle","2020","Marescot, Lucile; Lyet, Arnaud; Singh, Rohit; Carter, Neil; Gimenez, Olivier","Inferring wildlife poaching in southeast Asia with multispecies dynamic occupancy models","Ecography","","0906-7590, 1600-0587","10.1111/ecog.04536","https://onlinelibrary.wiley.com/doi/10.1111/ecog.04536","","2020-02","2021-10-27 03:37:54","2021-10-27 03:37:54","2021-10-27 03:37:54","239-250","","2","43","","Ecography","","","","","","","","en","","","","","DOI.org (Crossref)","","","","/Users/kelleherj/Zotero/storage/FSQZ3TB8/Marescot et al. - 2020 - Inferring wildlife poaching in southeast Asia with.pdf","","","","","","","","","","","","","","","","","","","","","","","","","","","","","","","","","","","","","","","","","","","","","","","","",""
"UDEWH2P2","journalArticle","2015","Nicol, Sam; Haynes, Trevor B.; Fensham, Rod; Kerezsy, Adam","Quantifying the impact of <i>Gambusia holbrooki</i> on the extinction risk of the critically endangered red-finned blue-eye","Ecosphere","","2150-8925","10.1890/ES14-00412.1","http://doi.wiley.com/10.1890/ES14-00412.1","Managing competing endangered and invasive species in spatially structured environments is challenging because it is often difficult to control invasive species without negatively impacting the endangered species. Effective management action requires an understanding of the factors affecting the presence and absence of each species so that promising sites for relocation of endangered species combined with eradication of invasive species can be identified. We investigate competing hypotheses about the factors affecting occupancy of the critically endangered red-finned blue-eye (Scaturiginichthys vermeilipinnis; hereafter ‘RFBE’), a native Australian fish with a global distribution that is restricted to a group of shallow artesian springs. RFBE are threatened by competition with invasive mosquito fish (Gambusia holbrooki ), which are steadily colonizing the springs, resulting in local extinctions of RFBE in most cases. While hypotheses about the influences of Gambusia on RFBE exist, none have been tested with a quantitative model. We used a spatially-structured two-species occupancy modeling approach to examine the occupancy dynamics of these fish and tested competing hypotheses on how Gambusia occupancy affected RFBE. Gambusia occupancy had a strong negative effect on RFBE occupancy and colonization potential; increasing the probability of local extinction at a spring and decreasing the persistence probability of RFBE in a spring by 8.0% 6 2.7% (mean 6 1 SE). We found strongest support for the hypotheses that elevation and spring area influence colonization, and that spring area influences patch extinction probability. Using colonization and local extinction estimates for both species, we identify promising sites for eradication of Gambusia and relocation of RFBE.","2015-03","2021-10-27 03:37:56","2021-10-27 03:37:56","2021-10-27 03:37:56","art41","","3","6","","Ecosphere","","","","","","","","en","","","","","DOI.org (Crossref)","","","","/Users/kelleherj/Zotero/storage/4NIC8NIT/Nicol et al. - 2015 - Quantifying the impact of Gambusia holbrookii.pdf","","","","","","","","","","","","","","","","","","","","","","","","","","","","","","","","","","","","","","","","","","","","","","","","",""
