"CJSQSLQI","journalArticle","2017","Brand, Adrianne B.; Grant, Evan H. Campbell","Design tradeoffs in long-term research for stream salamanders: Tradeoffs in Stream Salamander Site Selection","The Journal of Wildlife Management","","0022541X","10.1002/jwmg.21310","https://onlinelibrary.wiley.com/doi/10.1002/jwmg.21310","Long-term research programs can beneﬁt from early and periodic evaluation of their ability to meet stated objectives. In particular, consideration of the spatial allocation of effort is key. We sampled 4 species of stream salamanders intensively for 2 years (2010–2011) in the Chesapeake and Ohio Canal National Historical Park, Maryland, USA to evaluate alternative distributions of sampling locations within stream networks, and then evaluated via simulation the ability of multiple survey designs to detect declines in occupancy and to estimate dynamic parameters (colonization, extinction) over 5 years for 2 species. We expected that ﬁnescale microhabitat variables (e.g., cobble, detritus) would be the strongest determinants of occupancy for each of the 4 species; however, we found greater support for all species for models including variables describing position within the stream network, stream size, or stream microhabitat. A monitoring design focused on headwater sections had greater power to detect changes in occupancy and the dynamic parameters in each of 3 scenarios for the dusky salamander (Desmognathus fuscus) and red salamander (Pseudotriton ruber). Results for transect length were more variable, but across all species and scenarios, 25-m transects are most suitable as a balance between maximizing detection probability and describing colonization and extinction. These results inform sampling design and provide a general framework for setting appropriate goals, effort, and duration in the initial planning stages of research programs on stream salamanders in the eastern United States. Published 2017. This article is a U.S. Government work and is in the public domain in the USA.","2017-11","2021-10-27 03:37:59","2021-10-27 03:37:59","2021-10-27 03:37:59","1430-1438","","8","81","","Jour. Wild. Mgmt.","Design tradeoffs in long-term research for stream salamanders","","","","","","","en","","","","","DOI.org (Crossref)","","","","/Users/kelleherj/Zotero/storage/HB6FXWS2/Brand and Grant - 2017 - Design tradeoffs in long-term research for stream .pdf","","","","","","","","","","","","","","","","","","","","","","","","","","","","","","","","","","","","","","","","","","","","","","","","",""
"68SVNH3H","journalArticle","2017","Stahlecker, Dale W.; Wallace, Zachary P.; Mikesic, David G.; Smith, Chad S.","Does Hopi Religious Harvest of Eaglets Affect Golden Eagle Territory Occupancy and Reproduction on the Navajo Nation?","Journal of Raptor Research","","0892-1016, 2162-4569","10.3356/JRR-16-61.1","http://www.bioone.org/doi/10.3356/JRR-16-61.1","The Golden Eagle (Aquila chrysaetos) has great religious importance to many indigenous North American peoples, including the Hopi Tribe and Navajo Nation of the southwestern United States. Hopi oral traditions indicate their ancestors harvested nestling Golden Eagles prior to the arrival of Europeans to the region, and this religious practice continues today. Despite contemporary conservation concern for Golden Eagles, no studies have evaluated potential negative effects of religious harvest on populations of this species. We conducted aerial and ground searches for Golden Eagle nesting territories on the Navajo Nation from 1996–2005, and monitored occupancy and reproductive rates of territories in three study areas: one area where Hopi annually harvested eaglets, and two areas without harvest. We analyzed 9 yr of data (1997–2005) using multi-season occupancy models and generalized linear mixed models to test for differences among study areas in occupancy dynamics, and production of early-season and fledging-age nestlings. We found no significant differences in probabilities of occupancy, persistence, or colonization of territories between study areas. Territories in harvest and control areas produced similar numbers of nestlings early in the season; however, significantly fewer (53%) reached fledging age in the harvested area, suggesting collection of nestlings led to locally depressed fledgling production. Given possible declining trends of Golden Eagle populations in the southwestern U.S., we recommend continued monitoring and more intensive demographic studies to better understand the effects of religious harvest on the population of Golden Eagles nesting on the Navajo Nation.","2017-09","2021-10-27 03:38:02","2021-10-27 03:38:02","2021-10-27 03:38:02","305-318","","3","51","","Journal of Raptor Research","","","","","","","","en","","","","","DOI.org (Crossref)","","","","/Users/kelleherj/Zotero/storage/NIRDHKJ6/Stahlecker et al. - 2017 - Does Hopi Religious Harvest of Eaglets Affect Gold.pdf","","","","","","","","","","","","","","","","","","","","","","","","","","","","","","","","","","","","","","","","","","","","","","","","",""
"NRZV7SV6","journalArticle","2020","Lombardi, Jason V.; Tewes, Michael E.; Perotto-Baldivieso, Humberto L.; Mata, Jose M.; Campbell, Tyler A.","Spatial structure of woody cover affects habitat use patterns of ocelots in Texas","Mammal Research","","2199-2401, 2199-241X","10.1007/s13364-020-00501-2","https://link.springer.com/10.1007/s13364-020-00501-2","About 80% of the known breeding population of ocelots (Leopardus pardalis) in the USA occurs exclusively on private ranches in northern Willacy and Kenedy counties in South Texas. These private ranches support several large contiguous undisturbed patches of thornscrub, which is preferred by ocelots. Past studies have indicated ocelots in South Texas select for woody patches that contain extremely dense thornscrub (i.e., 95% canopy cover and 85% vertical cover) and require large patches of woody cover to survive. Landscape metrics have been used to explain ocelot habitat use in fragmented areas, but their application in lessfragmented rangelands is lacking. From 2011 to 2018, we used camera traps on the East Foundation’s El Sauz Ranch to assess seasonal habitat use of ocelots relative to landscape structure, configuration, and complexity and other site-level factors in South Texas. Seasonal habitat use and detection were positively influenced by larger mean patch area and lower landscape shape index values. We also observed ocelots were less likely to be detected during periods of drought and exhibited a seasonal trend in detection. Ocelots used woody patches that were larger and more regularly shaped, indicating a preference for areas with a lower degree of fragmentation across the study area. As patches become larger, they will coalesce over time and form larger woody aggregates, which will promote ocelot habitat use. Brush management needs to be strategic as patch area and shape index are a limiting factor to promote ocelot habitat use on working rangelands in South Texas. These results demonstrate the ability to use landscape metrics to discern the effects of spatial structure of vegetation communities relative to ocelot occupancy parameters.","2020-07","2021-10-27 03:38:05","2021-10-27 03:38:05","2021-10-27 03:38:05","555-563","","3","65","","Mamm Res","","","","","","","","en","","","","","DOI.org (Crossref)","","","","/Users/kelleherj/Zotero/storage/WG56IB7Q/Lombardi et al. - 2020 - Spatial structure of woody cover affects habitat u.pdf","","","","","","","","","","","","","","","","","","","","","","","","","","","","","","","","","","","","","","","","","","","","","","","","",""
"YWHSBFVL","journalArticle","2016","Magle, S. B.; Lehrer, E. W.; Fidino, M.","Urban mesopredator distribution: examining the relative effects of landscape and socioeconomic factors: Urban mesopredator role of socioeconomics","Animal Conservation","","13679430","10.1111/acv.12231","https://onlinelibrary.wiley.com/doi/10.1111/acv.12231","Cities harbor biodiversity, which has complex outcomes, both for humans and other animals. The situation is particularly complicated with carnivorous species such as mesopredators, which elicit strong positive and negative responses from urban residents. As cities are dominated by anthropogenic forces, socioeconomic factors likely play a major ecological role that has gone mostly unexplored for mammalian species. We used a large database of motion-triggered camera imagery to investigate relationships between landscape and socioeconomic features and the distribution of three mammalian mesopredator species in Chicago, IL. Coyotes and raccoons were most likely to colonize less urban sites, and coyotes were least likely to go extinct within sites with a high average per capita income. Opossum showed somewhat different dynamics, with added availability of habitat and increased housing density decreasing odds of new colonization. In general the socioeconomic variables performed at least as well as the habitat factors tested, indicating that there is a signiﬁcant role of both biotic and abiotic features in driving species distribution in this area. We suggest that new ecological frameworks incorporating both socioeconomic and ecological factors will be needed for the long-term management and conservation of wildlife in urban regions.","2016-04","2021-10-27 03:38:07","2021-10-27 03:38:07","2021-10-27 03:38:07","163-175","","2","19","","Anim Conserv","Urban mesopredator distribution","","","","","","","en","","","","","DOI.org (Crossref)","","","","/Users/kelleherj/Zotero/storage/XSQGCLD8/Magle et al. - 2016 - Urban mesopredator distribution examining the rel.pdf","","","","","","","","","","","","","","","","","","","","","","","","","","","","","","","","","","","","","","","","","","","","","","","","",""
"C4UAX4RI","journalArticle","2019","Lloyd, John D.; Rimmer, Christopher C.; Salguero-Faría, José A.","Short-term effects of hurricanes Maria and Irma on forest birds of Puerto Rico","PLOS ONE","","1932-6203","10.1371/journal.pone.0214432","https://dx.plos.org/10.1371/journal.pone.0214432","We compared occupancy in local assemblages of birds in forested areas across Puerto Rico during a winter before (2015) and shortly after (2018) the passage of hurricanes Irma and Maria. Using dynamic community models analyzed within a Bayesian framework, we found significant changes in detectability, with some species becoming more readily detected after the storms and others becoming more difficult to detect during surveys. Changes in occupancy were equally mixed. Five species–mostly granivores and omnivores, but also Black-whiskered Vireo (Vireo altiloquus), a migratory insectivore–occupied more sites in 2018 than in 2015. Twelve species were less common after the hurricanes, including all of the obligate frugivores. Declines in site-occupancy rates were not only more common than increases, but tended to be of greater magnitude. Our results support the general conclusions that bird species respond largely independently to changes in forest structure caused by hurricanes, but that some dietary guilds, notably frugivores, are more sensitive and more likely to show changes in abundance or occupancy following strong storms.","2019-06-11","2021-10-27 03:38:10","2021-10-27 03:38:10","2021-10-27 03:38:10","e0214432","","6","14","","PLoS ONE","","","","","","","","en","","","","","DOI.org (Crossref)","","","","/Users/kelleherj/Zotero/storage/MZXBQFPR/Lloyd et al. - 2019 - Short-term effects of hurricanes Maria and Irma on.pdf","","","","Amico, Guillermo C.","","","","","","","","","","","","","","","","","","","","","","","","","","","","","","","","","","","","","","","","","","","","",""
"QBRWX69P","journalArticle","","Weir, Linda; Fiske, Ian J; Royle, J Andrew","TRENDS IN ANURAN OCCUPANCY FROM NORTHEASTERN STATES OF THE NORTH AMERICAN AMPHIBIAN MONITORING PROGRAM","","","","","","We present the first multi-year occupancy trends from North American Amphibian Monitoring Program (NAAMP) data in 10 northeastern states using seven years of data (2001-2007). NAAMP uses a calling survey technique where observers listen for anuran vocalizations along assigned random roadside routes. We were able to assess occupancy trends in 10 northeastern states for 16 species and one species complex, for 94 species/state combinations. We found no significant trends for 64 species/state combinations. For the remaining 30 species/state combinations with significant trends, these split between declining and increasing trends. On a species-by-species basis, two species had declining trends, with significant trends in six states for Pseudacris crucifer and four states for Bufo americanus. The trends of Rana catesbeiana significantly increased in four states, but had no trend in the remaining states.","","2021-10-27 03:38:12","2021-10-27 03:38:12","","15","","","","","","","","","","","","","en","","","","","Zotero","","","","/Users/kelleherj/Zotero/storage/Q9TA4FLG/Weir et al. - TRENDS IN ANURAN OCCUPANCY FROM NORTHEASTERN STATE.pdf","","","","","","","","","","","","","","","","","","","","","","","","","","","","","","","","","","","","","","","","","","","","","","","","",""
"3MQ8TEP3","journalArticle","2021","Thapa, Kanchan; Malla, Sabita; Subba, Samundra Ambuhang; Thapa, Gokarna Jung; Lamichhane, Babu Ram; Subedi, Naresh; Dhakal, Maheshwar; Acharya, Krishna Prasad; Thapa, Madhuri Karki; Neupane, Pramod; Poudel, Shashank; Bhatta, Shiv Raj; Jnawali, Shant Raj; Kelly, Marcella J.","On the tiger trails: Leopard occupancy decline and leopard interaction with tigers in the forested habitat across the Terai Arc Landscape of Nepal","Global Ecology and Conservation","","23519894","10.1016/j.gecco.2020.e01412","https://linkinghub.elsevier.com/retrieve/pii/S2351989420309537","","2021-01","2021-10-27 03:53:28","2021-10-27 03:53:29","2021-10-27 03:53:28","e01412","","","25","","Global Ecology and Conservation","On the tiger trails","","","","","","","en","","","","","DOI.org (Crossref)","","","","/Users/kelleherj/Zotero/storage/U9V5E4JJ/Thapa et al. - 2021 - On the tiger trails Leopard occupancy decline and.pdf","","","","","","","","","","","","","","","","","","","","","","","","","","","","","","","","","","","","","","","","","","","","","","","","",""
"WRWWZESL","journalArticle","2020","MacGregor, Christopher I.; Blanchard, Wade; Stein, John A.; Lindenmayer, David B.","Factors influencing the occurrence of the Southern Long‐nosed Bandicoot ( <i>Perameles nasuta</i> Geoffroy) during a population irruption and decline","Austral Ecology","","1442-9985, 1442-9993","10.1111/aec.12930","https://onlinelibrary.wiley.com/doi/10.1111/aec.12930","","2020-09","2021-10-27 03:53:30","2021-10-27 03:53:30","2021-10-27 03:53:30","834-844","","6","45","","Austral Ecology","","","","","","","","en","","","","","DOI.org (Crossref)","","","","/Users/kelleherj/Zotero/storage/M49Y388R/MacGregor et al. - 2020 - Factors influencing the occurrence of the Southern.pdf","","","","","","","","","","","","","","","","","","","","","","","","","","","","","","","","","","","","","","","","","","","","","","","","",""
"PS6QA72F","journalArticle","2021","Forzley, Michael J.; Ryan, Mason J.; Latella, Ian M.; Giermakowski, J. Tomasz; Muths, Erin; Sigafus, Brent H.; Hossack, Blake R.","Staggered-Entry Analysis of Breeding Phenology and Occupancy Dynamics of Arizona Toads from Historically Occupied Habitats of New Mexico, USA","Ichthyology & Herpetology","","2766-1512","10.1643/h2020133","https://bioone.org/journals/ichthyology-and-herpetology/volume-109/issue-3/h2020133/Staggered-Entry-Analysis-of-Breeding-Phenology-and-Occupancy-Dynamics-of/10.1643/h2020133.full","","2021-09-24","2021-10-27 03:53:33","2021-10-27 03:53:33","2021-10-27 03:53:33","","","3","109","","Ichthyology & Herpetology","","","","","","","","en","","","","","DOI.org (Crossref)","","","","/Users/kelleherj/Zotero/storage/8F22KYIC/Forzley et al. - 2021 - Staggered-Entry Analysis of Breeding Phenology and.pdf","","","","","","","","","","","","","","","","","","","","","","","","","","","","","","","","","","","","","","","","","","","","","","","","",""
"3LDX5TB2","journalArticle","2010","Marucco, F.; McIntire, E. J. B.","Predicting spatio-temporal recolonization of large carnivore populations and livestock depredation risk: wolves in the Italian Alps: Wolf recolonization in the Alps","Journal of Applied Ecology","","00218901, 13652664","10.1111/j.1365-2664.2010.01831.x","https://onlinelibrary.wiley.com/doi/10.1111/j.1365-2664.2010.01831.x","","2010-06-07","2021-10-27 03:53:34","2021-10-27 03:53:35","2021-10-27 03:53:34","789-798","","4","47","","","Predicting spatio-temporal recolonization of large carnivore populations and livestock depredation risk","","","","","","","en","","","","","DOI.org (Crossref)","","","","/Users/kelleherj/Zotero/storage/ENAVNM9X/Marucco and McIntire - 2010 - Predicting spatio-temporal recolonization of large.pdf","","","","","","","","","","","","","","","","","","","","","","","","","","","","","","","","","","","","","","","","","","","","","","","","",""
"BU32UTWL","journalArticle","2013","Caruso, Nicholas M.; Lips, Karen R.","Truly enigmatic declines in terrestrial salamander populations in Great Smoky Mountains National Park","Diversity and Distributions","","13669516","10.1111/j.1472-4642.2012.00938.x","https://onlinelibrary.wiley.com/doi/10.1111/j.1472-4642.2012.00938.x","Aim Woodland salamanders (genus: Plethodon) declined synchronously across many protected areas in Eastern North America by the mid-1980s, but no cause was attributed to these declines. We hypothesized that the rapid, synchronous loss of several populations of many species was consistent with the invasive pathogen Batrachochytrium dendrobatidis (Bd), and we resurveyed historic sites to search for Bd in current populations.","2013-01","2021-10-27 03:53:37","2021-10-27 03:53:37","2021-10-27 03:53:37","38-48","","1","19","","Diversity Distrib.","","","","","","","","en","","","","","DOI.org (Crossref)","","","","/Users/kelleherj/Zotero/storage/BB8RQEQR/Caruso and Lips - 2013 - Truly enigmatic declines in terrestrial salamander.pdf","","","","","","","","","","","","","","","","","","","","","","","","","","","","","","","","","","","","","","","","","","","","","","","","",""
"8YR42DD4","journalArticle","2011","Adams, Michael J.; Pearl, Christopher A.; Galvan, Stephanie; Mccreary, Brome","Non-native species impacts on pond occupancy by an anuran: Anuran Occupancy Changes","The Journal of Wildlife Management","","0022541X","10.1002/jwmg.29","https://onlinelibrary.wiley.com/doi/10.1002/jwmg.29","","2011-01","2021-10-27 03:53:40","2021-10-27 03:53:40","2021-10-27 03:53:40","30-35","","1","75","","The Journal of Wildlife Management","Non-native species impacts on pond occupancy by an anuran","","","","","","","en","","","","","DOI.org (Crossref)","","","","/Users/kelleherj/Zotero/storage/J3DW7LAF/Adams et al. - 2011 - Non-native species impacts on pond occupancy by an.pdf","","","","","","","","","","","","","","","","","","","","","","","","","","","","","","","","","","","","","","","","","","","","","","","","",""
"CUME8S9L","journalArticle","","Colucci, Cristina","Evidence-based evaluation of artificial reptile habitats: A case study on stone structures","","","","","","","","2021-10-27 03:53:41","2021-10-27 03:53:41","","46","","","","","","","","","","","","","de","","","","","Zotero","","","","/Users/kelleherj/Zotero/storage/D3CFDAY3/Colucci - Evidence-based evaluation of artificial reptile ha.pdf","","","","","","","","","","","","","","","","","","","","","","","","","","","","","","","","","","","","","","","","","","","","","","","","",""
"U6IG4C6K","journalArticle","2018","Holland, Angela M.; Schauber, Eric M.; Nielsen, Clayton K.; Hellgren, Eric C.","Stream community richness predicts apex predator occupancy dynamics in riparian systems","Oikos","","00301299","10.1111/oik.05085","https://onlinelibrary.wiley.com/doi/10.1111/oik.05085","","2018-10","2021-10-27 03:53:43","2021-10-27 03:53:43","2021-10-27 03:53:43","1422-1436","","10","127","","Oikos","","","","","","","","en","","","","","DOI.org (Crossref)","","","","/Users/kelleherj/Zotero/storage/NQPI22K9/Holland et al. - 2018 - Stream community richness predicts apex predator o.pdf","","","","","","","","","","","","","","","","","","","","","","","","","","","","","","","","","","","","","","","","","","","","","","","","",""
"WYYJD85M","journalArticle","2016","Sultaire, Sean M.; Pauli, Jonathan N.; Martin, Karl J.; Meyer, Michael W.; Notaro, Michael; Zuckerberg, Benjamin","Climate change surpasses land-use change in the contracting range boundary of a winter-adapted mammal","Proceedings of the Royal Society B: Biological Sciences","","0962-8452, 1471-2954","10.1098/rspb.2015.3104","https://royalsocietypublishing.org/doi/10.1098/rspb.2015.3104","The effects of climate change on biodiversity have emerged as a dominant theme in conservation biology, possibly eclipsing concern over habitat loss in recent years. The extent to which this shifting focus has tracked the most eminent threats to biodiversity is not well documented. We investigated the mechanisms driving shifts in the southern range boundary of a forest and snow cover specialist, the snowshoe hare, to explore how its range boundary has responded to shifting rates of climate and land cover change over time. We found that although both forest and snow cover contributed to the historical range boundary, the current duration of snow cover best explains the most recent northward shift, while forest cover has declined in relative importance. In this respect, the southern range boundary of snowshoe hares has mirrored the focus of conservation research; first habitat loss and fragmentation was the stronger environmental constraint, but climate change has now become the main threat. Projections of future range shifts show that climate change, and associated snow cover loss, will continue to be the major driver of this species' range loss into the future.","2016-03-30","2021-10-27 03:53:46","2021-10-27 03:53:46","2021-10-27 03:53:46","20153104","","1827","283","","Proc. R. Soc. B.","","","","","","","","en","","","","","DOI.org (Crossref)","","","","/Users/kelleherj/Zotero/storage/GJX9PEC2/Sultaire et al. - 2016 - Climate change surpasses land-use change in the co.pdf","","","","","","","","","","","","","","","","","","","","","","","","","","","","","","","","","","","","","","","","","","","","","","","","",""
"T7ARHIJV","journalArticle","2020","Castañeda, Rowshyra A.; Mandrak, Nicholas E.; Barrow, Stuart; Weyl, Olaf L. F.","Occupancy dynamics of rare cyprinids after invasive fish eradication","Aquatic Conservation: Marine and Freshwater Ecosystems","","1052-7613, 1099-0755","10.1002/aqc.3364","https://onlinelibrary.wiley.com/doi/10.1002/aqc.3364","","2020-07","2021-10-27 04:01:14","2021-10-27 04:01:14","2021-10-27 04:01:14","1424-1436","","7","30","","Aquatic Conserv: Mar Freshw Ecosyst","","","","","","","","en","","","","","DOI.org (Crossref)","","","","/Users/kelleherj/Zotero/storage/8BW2SU52/Castañeda et al. - 2020 - Occupancy dynamics of rare cyprinids after invasiv.pdf","","","","","","","","","","","","","","","","","","","","","","","","","","","","","","","","","","","","","","","","","","","","","","","","",""
"VVQHYCGR","journalArticle","2017","Astete, S.; Marinho-Filho, J.; Kajin, M.; Penido, G.; Zimbres, B.; Sollmann, R.; Jácomo, A.T.A.; Tôrres, N.M.; Silveira, L.","Forced neighbours: Coexistence between jaguars and pumas in a harsh environment","Journal of Arid Environments","","01401963","10.1016/j.jaridenv.2017.07.005","https://linkinghub.elsevier.com/retrieve/pii/S0140196317301374","Carnivores face conﬂicts with humans, which has reduced their numbers and distribution. Carnivores compete in intraguild predation systems, Subordinate predators usually avoid top predators through spatial or temporal separation. Coexistence requires a complex combination of resources and environmental conditions. In this study, we assessed the occupancy and temporal activity during night time of the jaguar (Panthera onca) and puma (Puma concolor) in the Serra da Capivara National Park (SCNP), located in the semi-arid Caatinga biome of Brazil. Felines face biological limitations in hot environments. We used camera-traps, occupancy models and temporal analysis to evaluate their patterns of habitat use, activity and interactions in SCNP between 2009 and 2011. We considered jaguar as dominant predator and puma as subordinate, and expected to ﬁnd spatial and temporal avoidance between them. We found evidence of spatial and temporal coexistence. This coexistence could be a result of a restriction of niche separation between both species, inﬂuenced by the harsh conditions in the Caatinga, represented by a combination of extreme temperatures, scarcity of refuges to thermoregulate, an environment around SCNP with a high level of human disturbance and an apparent increase in prey due conservation policies. Crown Copyright © 2017 Published by Elsevier Ltd. All rights reserved.","2017-11","2021-10-27 04:04:59","2021-10-27 04:04:59","2021-10-27 04:04:59","27-34","","","146","","Journal of Arid Environments","Forced neighbours","","","","","","","en","","","","","DOI.org (Crossref)","","","","/Users/kelleherj/Zotero/storage/EWQ69PDQ/Astete et al. - 2017 - Forced neighbours Coexistence between jaguars and.pdf","","","","","","","","","","","","","","","","","","","","","","","","","","","","","","","","","","","","","","","","","","","","","","","","",""
